<?xml version="1.0" encoding="UTF-8"?>

<xs:schema xmlns:xs="http://www.w3.org/2001/XMLSchema"
	xmlns:sc="http://www.saucecode.com/packer/xml" targetNamespace="http://www.saucecode.com/packer/xml"
	elementFormDefault="qualified">

	<xs:simpleType name="string">
		<xs:restriction base="xs:string">
			<xs:pattern value="([a-z A-Z äöü ÄÖÜ ß \- / + ()])*" />
			<xs:minLength value="1" />
		</xs:restriction>
	</xs:simpleType>

	<xs:simpleType name="shortString">
		<xs:restriction base="sc:string">
			<xs:maxLength value="40" />
		</xs:restriction>
	</xs:simpleType>

	<xs:simpleType name="longString">
		<xs:restriction base="sc:string">
			<xs:maxLength value="140" />
		</xs:restriction>
	</xs:simpleType>

	<xs:element name="name">
		<xs:simpleType>
			<xs:restriction base="sc:shortString" />
		</xs:simpleType>
	</xs:element>

	<xs:element name="category">
		<xs:simpleType>
			<xs:restriction base="sc:shortString" />
		</xs:simpleType>
	</xs:element>

	<xs:element name="set">
		<xs:simpleType>
			<xs:restriction base="sc:shortString" />
		</xs:simpleType>
	</xs:element>

	<xs:element name="description">
		<xs:simpleType>
			<xs:restriction base="sc:longString" />
		</xs:simpleType>
	</xs:element>

	<xs:element name="categories">
		<xs:complexType>
			<xs:sequence>
				<xs:element ref="sc:category" maxOccurs="unbounded" />
			</xs:sequence>
		</xs:complexType>
		<xs:unique name="uniqueCategory">
			<xs:selector xpath="sc:category" />
			<xs:field xpath="." />
		</xs:unique>
	</xs:element>

	<xs:element name="sets">
		<xs:complexType>
			<xs:sequence>
				<xs:element ref="sc:set" maxOccurs="unbounded" />
			</xs:sequence>
		</xs:complexType>
		<xs:unique name="uniqueSet">
			<xs:selector xpath="sc:set" />
			<xs:field xpath="." />
		</xs:unique>
	</xs:element>

	<xs:element name="items">
		<xs:complexType>
			<xs:sequence>
				<xs:element ref="sc:item" maxOccurs="unbounded" />
			</xs:sequence>
		</xs:complexType>
		<xs:unique name="uniqueItemName">
			<xs:selector xpath="sc:item" />
			<xs:field xpath="sc:name" />
		</xs:unique>
	</xs:element>

	<xs:element name="item">
		<xs:complexType>
			<xs:sequence>
				<xs:element ref="sc:name" />
				<xs:element ref="sc:category" />
				<xs:element ref="sc:description" minOccurs="0" />
				<xs:element ref="sc:sets" />
			</xs:sequence>
		</xs:complexType>
	</xs:element>

	<xs:element name="library">
		<xs:complexType>
			<xs:sequence>
				<xs:element ref="sc:sets" />
				<xs:element ref="sc:categories" />
				<xs:element ref="sc:items" />
			</xs:sequence>
		</xs:complexType>
		<xs:key name="setKey">
			<xs:selector xpath="sc:sets/sc:set" />
			<xs:field xpath="." />
		</xs:key>
		<xs:keyref name="setKeyRef" refer="sc:setKey">
			<xs:selector xpath="sc:items/sc:item/sc:sets/sc:set" />
			<xs:field xpath="." />
		</xs:keyref>
		<xs:key name="categoryKey">
			<xs:selector xpath="sc:categories/sc:category" />
			<xs:field xpath="." />
		</xs:key>
		<xs:keyref name="categoryKeyRef" refer="sc:categoryKey">
			<xs:selector xpath="sc:items/sc:item/sc:category" />
			<xs:field xpath="." />
		</xs:keyref>
	</xs:element>

</xs:schema>