<?xml version="1.0" encoding="UTF-8" standalone="yes"?>
<library xmlns="http://www.saucecode.com/packer/xml" xmlns:xsi="http://www.w3.org/2001/XMLSchema-instance"
	xsi:schemaLocation="http://www.saucecode.com/packer/xml library.xsd">
	<sets>
		<!-- This list also defines the order of all sets -->
		<set>Urlaub</set>
		<set>Festival</set>
		<set>Camping</set>
		<set>Wintersport</set>
		<set>Wandern</set>
		<set>Strand</set>
		<set>See</set>
		<set>Freibad</set>
		<set>Hallenbad</set>
	</sets>
	<categories>
		<!-- This list also defines the order of all categories -->
		<category>Finanzen</category>
		<category>Hygiene</category>
		<category>Kleidung</category>
		<category>Papiere / Unterlagen</category>
		<category>Elektronik</category>
		<category>Campingzubehör</category>
		<category>Badeartikel</category>
		<category>Sportartikel</category>
		<category>Sonstiges</category>
	</categories>
	<items>
		<!-- This list also defines the order of all items inside their category -->
		<item>
			<name>Portemonnaie</name>
			<category>Finanzen</category>
			<sets>
				<set>Festival</set>
				<set>Urlaub</set>
			</sets>
		</item>
		<item>
			<name>Bargeld</name>
			<category>Finanzen</category>
			<sets>
				<set>Urlaub</set>
				<set>Festival</set>
			</sets>
		</item>
		<item>
			<name>EC-Karte</name>
			<category>Finanzen</category>
			<sets>
				<set>Urlaub</set>
				<set>Festival</set>
			</sets>
		</item>
		<item>
			<name>Kreditkarte</name>
			<category>Finanzen</category>
			<sets>
				<set>Urlaub</set>
			</sets>
		</item>
		<item>
			<name>Notfall-Telefonnummern der Bank</name>
			<category>Finanzen</category>
			<sets>
				<set>Urlaub</set>
			</sets>
		</item>
		<item>
			<name>Bürste / Kamm</name>
			<category>Hygiene</category>
			<sets>
				<set>Urlaub</set>
				<set>Camping</set>
			</sets>
		</item>
		<item>
			<name>Deodorant</name>
			<category>Hygiene</category>
			<sets>
				<set>Urlaub</set>
				<set>Festival</set>
				<set>Camping</set>
			</sets>
		</item>
		<item>
			<name>Duschgel</name>
			<category>Hygiene</category>
			<sets>
				<set>Urlaub</set>
				<set>Festival</set>
				<set>Camping</set>
				<set>Freibad</set>
				<set>Hallenbad</set>
			</sets>
		</item>
		<item>
			<name>Shampoo</name>
			<category>Hygiene</category>
			<sets>
				<set>Urlaub</set>
				<set>Festival</set>
				<set>Camping</set>
				<set>Freibad</set>
				<set>Hallenbad</set>
			</sets>
		</item>
		<item>
			<name>Handtuch</name>
			<category>Hygiene</category>
			<sets>
				<set>Urlaub</set>
				<set>Festival</set>
				<set>Camping</set>
			</sets>
		</item>
		<item>
			<name>Sonnencreme</name>
			<category>Hygiene</category>
			<sets>
				<set>Urlaub</set>
				<set>Festival</set>
				<set>Camping</set>
				<set>Strand</set>
				<set>See</set>
				<set>Freibad</set>
				<set>Wintersport</set>
			</sets>
		</item>
		<item>
			<name>Kontaktlinsen / Brille</name>
			<category>Hygiene</category>
			<sets>
				<set>Urlaub</set>
				<set>Festival</set>
				<set>Camping</set>
			</sets>
		</item>
		<item>
			<name>Nagelpflegeset</name>
			<category>Hygiene</category>
			<sets>
				<set>Urlaub</set>
				<set>Camping</set>
			</sets>
		</item>
		<item>
			<name>Rasierer</name>
			<category>Hygiene</category>
			<sets>
				<set>Urlaub</set>
				<set>Camping</set>
			</sets>
		</item>
		<item>
			<name>Verhütungsmittel / Kondome</name>
			<category>Hygiene</category>
			<sets>
				<set>Urlaub</set>
				<set>Festival</set>
				<set>Camping</set>
			</sets>
		</item>
		<item>
			<name>Zahnbürste + Zahnpasta</name>
			<category>Hygiene</category>
			<sets>
				<set>Urlaub</set>
				<set>Festival</set>
				<set>Camping</set>
			</sets>
		</item>
		<item>
			<name>Pullover</name>
			<category>Kleidung</category>
			<sets>
				<set>Urlaub</set>
				<set>Festival</set>
				<set>Camping</set>
			</sets>
		</item>
		<item>
			<name>Hosen / Shorts (kurz)</name>
			<category>Kleidung</category>
			<sets>
				<set>Urlaub</set>
				<set>Festival</set>
				<set>Camping</set>
			</sets>
		</item>
		<item>
			<name>Hosen / Jeans (lang)</name>
			<category>Kleidung</category>
			<sets>
				<set>Urlaub</set>
				<set>Festival</set>
				<set>Camping</set>
			</sets>
		</item>
		<item>
			<name>Gürtel</name>
			<category>Kleidung</category>
			<sets>
				<set>Urlaub</set>
				<set>Festival</set>
				<set>Camping</set>
			</sets>
		</item>
		<item>
			<name>Regenjacke</name>
			<category>Kleidung</category>
			<sets>
				<set>Urlaub</set>
				<set>Festival</set>
				<set>Camping</set>
			</sets>
		</item>
		<item>
			<name>Schlafanzug</name>
			<category>Kleidung</category>
			<sets>
				<set>Urlaub</set>
				<set>Festival</set>
				<set>Camping</set>
			</sets>
		</item>
		<item>
			<name>Socken</name>
			<category>Kleidung</category>
			<sets>
				<set>Urlaub</set>
				<set>Festival</set>
				<set>Camping</set>
			</sets>
		</item>
		<item>
			<name>T-Shirts</name>
			<category>Kleidung</category>
			<sets>
				<set>Urlaub</set>
				<set>Festival</set>
				<set>Camping</set>
			</sets>
		</item>
		<item>
			<name>Unterwäsche</name>
			<category>Kleidung</category>
			<sets>
				<set>Urlaub</set>
				<set>Festival</set>
				<set>Camping</set>
			</sets>
		</item>
		<item>
			<name>Schuhe</name>
			<category>Kleidung</category>
			<sets>
				<set>Urlaub</set>
				<set>Festival</set>
				<set>Camping</set>
			</sets>
		</item>
		<item>
			<name>Wanderschuhe</name>
			<category>Kleidung</category>
			<sets>
				<set>Wandern</set>
			</sets>
		</item>
		<item>
			<name>Schneestiefel</name>
			<category>Kleidung</category>
			<sets>
				<set>Wintersport</set>
			</sets>
		</item>
		<item>
			<name>Skijacke</name>
			<category>Kleidung</category>
			<sets>
				<set>Wintersport</set>
			</sets>
		</item>
		<item>
			<name>Skihose</name>
			<category>Kleidung</category>
			<sets>
				<set>Wintersport</set>
			</sets>
		</item>
		<item>
			<name>Skisocken</name>
			<category>Kleidung</category>
			<sets>
				<set>Wintersport</set>
			</sets>
		</item>
		<item>
			<name>Handschuhe</name>
			<category>Kleidung</category>
			<sets>
				<set>Wintersport</set>
			</sets>
		</item>
		<item>
			<name>Thermowäsche</name>
			<category>Kleidung</category>
			<sets>
				<set>Wintersport</set>
			</sets>
		</item>
		<item>
			<name>Schal</name>
			<category>Kleidung</category>
			<sets>
				<set>Wintersport</set>
			</sets>
		</item>
		<item>
			<name>Hausschuhe</name>
			<category>Kleidung</category>
			<sets>
				<set>Urlaub</set>
				<set>Wintersport</set>
			</sets>
		</item>
		<item>
			<name>Adressliste für Postkarten</name>
			<category>Papiere / Unterlagen</category>
			<sets>
				<set>Urlaub</set>
				<set>Camping</set>
			</sets>
		</item>
		<item>
			<name>Personalausweis / Reisepass</name>
			<category>Papiere / Unterlagen</category>
			<sets>
				<set>Urlaub</set>
				<set>Festival</set>
				<set>Camping</set>
			</sets>
		</item>
		<item>
			<name>Führerschein</name>
			<category>Papiere / Unterlagen</category>
			<sets>
				<set>Urlaub</set>
				<set>Festival</set>
				<set>Camping</set>
			</sets>
		</item>
		<item>
			<name>Tickets / Buchungsbelege</name>
			<category>Papiere / Unterlagen</category>
			<sets>
				<set>Urlaub</set>
				<set>Festival</set>
				<set>Camping</set>
			</sets>
		</item>
		<item>
			<name>Studentenausweis / Schülerausweis</name>
			<category>Papiere / Unterlagen</category>
			<sets>
				<set>Urlaub</set>
				<set>Festival</set>
				<set>Camping</set>
			</sets>
		</item>
		<item>
			<name>Handy + Ladekabel</name>
			<category>Elektronik</category>
			<sets>
				<set>Urlaub</set>
				<set>Festival</set>
				<set>Camping</set>
			</sets>
		</item>
				<item>
			<name>Tablet + Ladekabel</name>
			<category>Elektronik</category>
			<sets>
				<set>Urlaub</set>
				<set>Camping</set>
			</sets>
		</item>
		<item>
			<name>Digitalkamera + Ladekabel</name>
			<category>Elektronik</category>
			<sets>
				<set>Urlaub</set>
				<set>Festival</set>
				<set>Camping</set>
			</sets>
		</item>
		<item>
			<name>eBook Reader + Ladekabel</name>
			<category>Elektronik</category>
			<sets>
				<set>Urlaub</set>
				<set>Camping</set>
			</sets>
		</item>
		<item>
			<name>Taschenlampe + Batterien</name>
			<category>Elektronik</category>
			<sets>
				<set>Festival</set>
				<set>Camping</set>
			</sets>
		</item>
		<item>
			<name>Kopfhörer</name>
			<category>Elektronik</category>
			<sets>
				<set>Urlaub</set>
				<set>Camping</set>
			</sets>
		</item>
		<item>
			<name>Action-Camcorder</name>
			<category>Elektronik</category>
			<sets>
				<set>Wintersport</set>
			</sets>
		</item>
		<item>
			<name>Zelt + Heringe</name>
			<category>Campingzubehör</category>
			<sets>
				<set>Festival</set>
				<set>Camping</set>
			</sets>
		</item>
		<item>
			<name>Isomatte</name>
			<category>Campingzubehör</category>
			<sets>
				<set>Festival</set>
				<set>Camping</set>
			</sets>
		</item>
		<item>
			<name>Schlafsack</name>
			<category>Campingzubehör</category>
			<sets>
				<set>Festival</set>
				<set>Camping</set>
			</sets>
		</item>
		<item>
			<name>Pavillion</name>
			<category>Campingzubehör</category>
			<sets>
				<set>Festival</set>
			</sets>
		</item>
		<item>
			<name>Campingstuhl</name>
			<category>Campingzubehör</category>
			<sets>
				<set>Festival</set>
				<set>Camping</set>
			</sets>
		</item>
		<item>
			<name>Campingtisch</name>
			<category>Campingzubehör</category>
			<sets>
				<set>Festival</set>
				<set>Camping</set>
			</sets>
		</item>